זרעים	ברכות	א	1	מאימתי קורין את שמע בערבין.  משעה שהכהנים נכנסים לאכול בתרומתן עד סוף האשמורה הראשונה דברי ר' אליעזר.  וחכמים אומרים עד חצות.  רבן גמליאל אומר עד שיעלה עמוד השחר.  מעשה ובאו בניו מבית המשתה אמרו לו לא קרינו את שמע אמר להם אם לא עלה עמוד השחר חייבין אתם לקרות ולא זו בלבד אמרו אלא כל מה שאמרו חכמים עד חצות מצותן עד שיעלה עמוד השחר הקטר חלבים ואברים מצותן עד שיעלה עמוד השחר וכל הנאכלים ליום אחד מצותן עד שיעלה עמוד השחר א"כ למה אמרו חכמים עד חצות כדי להרחיק אדם מן העבירה:
זרעים	ברכות	א	2	מאימתי קורין את שמע בשחרית משיכיר בין תכלת ללבן ר' אליעזר אומר בין תכלת לכרתי <וגומרה> עד הנץ החמה ר' יהושע אומר עד שלש שעות שכן דרך מלכים לעמוד בשלש שעות הקורא מכאן ואילך לא הפסיד כאדם הקורא בתורה:
זרעים	ברכות	א	3	בית שמאי אומרים בערב כל אדם יטה ויקרא ובבקר יעמוד שנאמר (דברים ו) ובשכבך ובקומך ובית הלל אומרים כל אדם קורא כדרכו שנאמר ובלכתך בדרך אם כן למה נאמר ובשכבך ובקומך בשעה שבני אדם שוכבים ובשעה שבני אדם עומדים א"ר טרפון אני הייתי בא בדרך והטתי לקרות כדברי ב"ש וסכנתי בעצמי מפני הלסטים אמרו לו כדי היית לחוב בעצמך שעברת על דברי ב"ה:
זרעים	ברכות	א	4	בשחר מברך שתים לפניה ואחת לאחריה ובערב מברך שתים לפניה ושתים לאחריה אחת ארוכה ואחת קצרה מקום שאמרו להאריך אינו רשאי לקצר לקצר אינו רשאי להאריך לחתום אינו רשאי שלא לחתום שלא לחתום אינו רשאי לחתום:
זרעים	ברכות	ב	5	מזכירין יציאת מצרים בלילות א"ר אלעזר בן עזריה הרי אני כבן שבעים שנה ולא זכיתי שתאמר יציאת מצרים בלילות עד שדרשה בן זומא שנא' (דברים טז) למען תזכור את יום צאתך מארץ מצרים כל ימי חייך ימי חייך הימים כל ימי חייך הלילות וחכ"א ימי חייך העוה"ז כל להביא לימות המשיח:
זרעים	ברכות	ב	6	היה קורא בתורה והגיע זמן המקרא אם כוון לבו יצא בפרקים שואל מפני הכבוד ומשיב ובאמצע שואל מפני היראה ומשיב דברי ר' מאיר ר' יהודה אומר באמצע שואל מפני היראה ומשיב מפני הכבוד ובפרקים שואל מפני הכבוד ומשיב שלום לכל אדם אלו הן בין הפרקים בין ברכה ראשונה לשניה בין שניה לשמע בין שמע לוהיה אם שמוע בין והיה אם שמוע לויאמר בין ויאמר לאמת ויציב ר' יהודה אומר בין ויאמר לאמת ויציב לא יפסיק אמר ר' יהושע בן קרחה למה קדמה פרשת שמע לוהיה אם שמוע כדי שיקבל עליו עול מלכות שמים תחלה ואחר כך מקבל עליו עול מצות והיה אם שמוע לויאמר שוהיה אם שמוע נוהג בין ביום ובין בלילה ויאמר אינו נוהג אלא ביום בלבד:
זרעים	ברכות	ב	7	הקורא את שמע ולא השמיע לאזנו יצא ר' יוסי אומר לא יצא קרא ולא דקדק באותיותיה ר' יוסי אומר יצא רבי יהודה אומר לא יצא הקורא למפרע לא יצא קרא וטעה יחזור למקום שטעה:
זרעים	ברכות	ב	8	האומנין קורין בראש האילן ובראש הנדבך מה שאינן רשאין לעשות כן בתפלה חתן פטור מק"ש לילה הראשונה ועד מוצאי שבת אם לא עשה מעשה ומעשה בר"ג שנשא אשה וקרא לילה הראשונה אמרו לו תלמידיו למדתנו רבינו שחתן פטור מק"ש אמר להם איני שומע לכם לבטל הימני מלכות שמים אפילו שעה אחת:
זרעים	ברכות	ג	9	רחץ לילה הראשון שמתה אשתו אמרו לו תלמידיו למדתנו רבינו שאבל אסור לרחוץ אמר להם איני כשאר בני אדם אסטניס אני וכשמת טבי עבדו קבל עליו תנחומין אמרו לו תלמידיו למדתנו רבינו שאין מקבלין תנחומין על העבדים אמר להם אין טבי עבדי כשאר כל העבדים כשר היה חתן אם רוצה לקרות קרית שמע לילה הראשון קורא רבן שמעון בן גמליאל אומר לא כל הרוצה ליטול את השם יטול:
זרעים	ברכות	ג	10	מי שמתו מוטל לפניו פטור מק"ש ומן התפלה ומן התפילין ומכל מצות האמורות בתורה נושאי המטה וחלופיהן וחלופי חלופיהן את שלפני המטה ואת שלאחר המטה את שלפני המטה צורך בהם פטורין ואת שלאחר המטה צורך בהם חייבין ואלו ואלו פטורים מן התפלה קברו את המת וחזרו אם יכולין להתחיל ולגמור עד שלא יגיעו לשורה יתחילו ואם לאו לא יתחילו העומדים בשורה הפנימיים פטורים והחיצונים חייבים <נשים ועבדים וקטנים פטורים מק"ש ומן התפילין וחייבין בתפלה ובמזוזה ובברכת המזון>:
זרעים	ברכות	ג	11	נשים ועבדים וקטנים פטורין מק"שומן התפלין וחייבין בתפלה ובמזוזה ובברכת המזון:
זרעים	ברכות	ג	12	בעל קרי מהרהר בלבו ואינו מברך לא לפניה ולא לאחריה ועל המזון מברך לאחריו ואינו מברך לפניו רבי יהודה אומר מברך לפניהם ולאחריהם:
זרעים	ברכות	ג	13	היה עומד בתפלה ונזכר שהוא בעל קרי לא יפסיק אלא יקצר ירד לטבול אם יכול לעלות ולהתכסות ולקרות עד שלא תהא הנץ החמה יעלה ויתכסה ויקרא ואם לאו יתכסה במים ויקרא ולא יתכסה לא במים הרעים ולא במי המשרה עד שיטיל לתוכן מים וכמה ירחיק מהן ומן הצואה ד' אמות:
זרעים	ברכות	ד	14	זב שראה קרי ונדה שפלטה שכבת זרע והמשמשת שראתה נדה צריכין טבילה ורבי יהודה פוטר:
זרעים	ברכות	ד	15	תפלת השחר עד חצות ר' יהודה אומר עד ד' שעות תפלת המנחה עד הערב רבי יהודה אומר עד פלג המנחה תפלת הערב אין לה קבע ושל מוספים כל היום <ר' יהודה אומר עד ז' שעות>:
זרעים	ברכות	ד	16	ר' נחוניא בן הקנה היה מתפלל בכניסתו לבית המדרש וביציאתו תפלה קצרה אמרו לו מה מקום לתפלה זו אמר להם בכניסתי אני מתפלל שלא יארע דבר תקלה על ידי וביציאתי אני נותן הודאה על חלקי:
זרעים	ברכות	ד	17	רבן גמליאל אומר בכל יום ויום מתפלל אדם שמנה עשרה רבי יהושע אומר מעין י"ח ר"ע אומר אם שגורה תפלתו בפיו מתפלל י"ח ואם לאו מעין י"ח ר"א אומר העושה תפלתו קבע אין תפלתו תחנונים ר' יהושע אומר ההולך במקום סכנה מתפלל תפלה קצרה ואומר הושע ה' את עמך את שארית ישראל בכל פרשת העבור יהיו צרכיהם לפניך ברוך אתה ה' שומע תפלה היה רוכב על החמור ירד ויתפלל ואם אינו יכול לירד יחזיר את פניו ואם אינו יכול להחזיר את פניו יכוין את לבו כנגד בית קדשי הקדשים היה מהלך בספינה או באסדא יכוין את לבו כנגד בית קדשי הקדשים:
זרעים	ברכות	ה	18	ר' אלעזר בן עזריה אומר אין תפלת המוספין אלא בחבר עיר וחכ"א בחבר עיר ושלא בחבר עיר ר' יהודה אומר משמו כל מקום שיש שם חבר עיר יחיד פטור מתפלת המוספין:
זרעים	ברכות	ה	19	אין עומדין להתפלל אלא מתוך כובד ראש חסידים הראשונים היו שוהין שעה אחת ומתפללין כדי שיכוונו לבם לאביהם שבשמים אפי' המלך שואל בשלומו לא ישיבנו ואפי' נחש כרוך על עקבו לא יפסיק:
זרעים	ברכות	ה	20	מזכירין גבורות גשמים בתחיית המתים ושאלה בברכת השנים והבדלה בחונן הדעת ר"ע אומר אומרה ברכה רביעית בפני עצמה רבי אליעזר אומר בהודאה:
זרעים	ברכות	ה	21	האומר על קן צפור יגיעו רחמיך ועל טוב יזכר שמך מודים מודים משתקין אותו:
זרעים	ברכות	ה	22	<האומר יברכוך טובים הרי זה דרכי מינות> העובר לפני התיבה וטעה יעבור אחר תחתיו ולא יהא סרבן באותה שעה מהיכן הוא מתחיל מתחלת הברכה שטעה זה העובר לפני התיבה לא יענה אמן אחר הכהנים מפני הטרוף ואם אין שם כהן אלא הוא לא ישא את כפיו ואם הבטחתו שהוא נושא את כפיו וחוזר לתפלתו רשאי:
זרעים	ברכות	ו	23	המתפלל וטעה סימן רע לו ואם שליח צבור הוא סימן רע לשולחיו מפני ששלוחו של אדם כמותו אמרו עליו על ר' חנינא בן דוסא שהיה מתפלל על החולים ואומר זה חי וזה מת אמרו לו מנין אתה יודע אמר להם אם שגורה תפלתי בפי יודע אני שהוא מקובל ואם לאו יודע אני שהוא מטורף:
זרעים	ברכות	ו	24	כיצד מברכין על הפירות על פירות האילן הוא אומר בורא פרי העץ חוץ מן היין שעל היין הוא אומר בורא פרי הגפן ועל פירות הארץ הוא אומר בורא פרי האדמה חוץ מן הפת שעל הפת הוא אומר המוציא לחם מן הארץ ועל הירקות הוא אומר בורא פרי האדמה רבי יהודה אומר בורא מיני דשאים:
זרעים	ברכות	ו	25	בירך על פירות האילן בורא פרי האדמה יצא ועל פירות הארץ בורא פרי העץ לא יצא ועל כולם אם אמר שהכל נהיה בדברו יצא:
זרעים	ברכות	ו	26	ועל דבר שאין גדולו מן הארץ אומר שהכל נהיה בדברו על החומץ ועל הנובלות ועל הגובאי אומר שהכל נהיה בדברו ר' יהודה אומר כל שהוא מין קללה אין מברכין עליו היו לפניו מינין הרבה ר' יהודה אומר אם יש ביניהן מין שבעה עליו הוא מברך וחכ"א מברך על איזה מהן שירצה:
זרעים	ברכות	ו	27	ברך על היין שלפני המזון פטר את היין שלאחר המזון ברך על הפרפרת שלפני המזון פטר את הפרפרת שלאחר המזון ברך על הפת פטר את הפרפרת על הפרפרת לא פטר את הפת בש"א אף לא מעשה קדרה היו יושבין כל אחד מברך לעצמו הסבו אחד מברך לכולןבא להם יין בתוך המזון כל אחד ואחד מברך לעצמו אחר המזון אחד מברך לכולם והוא אומר על המוגמר ואע"פ שאין מביאין את המוגמר אלא לאחר סעודה:
זרעים	ברכות	ו	28	הביאו לפניו מליח תחלה ופת עמו מברך על המליח ופוטר את הפת שהפת טפלה לו זה הכלל כל שהוא עיקר ועמו טפלה מברך על העיקר ופוטר את הטפלה:
זרעים	ברכות	ז	29	אכל ענבים ותאנים ורמונים מברך אחריהם שלש ברכות דברי רבן גמליאל וחכ"א ברכה אחת <מעין שלש> ר"ע אומר אפי' אכל שלק והוא מזונו מברך עליו ג' ברכות השותה מים לצמאו מברך שהכל נהיה בדברו ר' טרפון אומר בורא נפשות רבות וחסרונן:
זרעים	ברכות	ז	30	שלשה שאכלו כאחת חייבין לזמן אכל דמאי ומעשר ראשון שנטלה תרומתו מעשר שני והקדש שנפדו והשמש שאכל כזית והכותי מזמנין עליו אכל טבל ומעשר ראשון שלא נטלה תרומתו ומעשר שני והקדש שלא נפדו והשמש שאכל פחות מכזית והנכרי אין מזמנין עליו נשים ועבדים וקטנים אין מזמנין עליהן עד כמה מזמנין עד כזית ר' יהודה אומר עד כביצה:
זרעים	ברכות	ז	31	כיצד מזמנין בשלשה אומר נברך בשלשה והוא אומר ברכו בעשרה אומר נברך אלהינו בעשרה והוא אומר ברכו אחד עשרה ואחד עשרה רבוא במאה הוא אומר נברך ה' אלהינו במאה והוא אומר ברכו ובאלף הוא אומר נברך לה' אלהינו אלהי ישראל באלף והוא אומר ברכו ברבוא אומר נברך לה' אלהינו אלהי ישראל אלהי צבאות יושב הכרובים על המזון שאכלנו ברבוא והוא אומר ברכו כענין שהוא מברך כך עונים אחריו ברוך ה' אלהינו אלהי ישראל אלהי צבאות יושב הכרובים על המזון שאכלנו ר' יוסי הגלילי אומר לפי רוב הקהל הם מברכים שנאמר (תהילים סח) במקהלות ברכו אלהים ה' ממקור ישראל אמר ר' עקיבא מה מצינו בבית הכנסת אחד מרובים ואחד מועטים אומר ברכו את ה' רבי ישמעאל אומר ברכו את ה' המבורך:
זרעים	ברכות	ח	32	ג' שאכלו כאחת אינן רשאין ליחלק וכן ד' וכן חמשה ו' נחלקין עד עשרה ועשרה אין נחלקין עד כ' שתי חבורות שהיו אוכלות בבית אחד בזמן שמקצתן רואין אלו את אלו הרי אלו מצטרפין לזמון ואם לאו אלו מזמנין לעצמן ואלו מזמנין לעצמן אין מברכין על היין עד שיתן לתוכו מים דברי ר' אליעזר וחכ"א מברכין:
זרעים	ברכות	ט	33	אלו דברים שבין בית שמאי ובין בית הלל בסעודה ב"ש אומרים מברך על היום ואח"כ מברך על היין וב"ה אומרים מברך על היין ואחר כך מברך על היום ב"ש אומרים נוטלין לידים ואח"כ מוזגין את הכוס וב"ה אומרים מוזגין את הכוס ואח"כ נוטלין לידים ב"ש אומרים מקנח ידיו במפה ומניחה על השלחן וב"ה אומרים על הכסת ב"ש אומרים מכבדין את הבית ואח"כ נוטלין לידים וב"ה אומרים נוטלין לידים ואח"כ מכבדין את הבית ב"ש אומרים נר ומזון בשמים והבדלה וב"ה אומרים נר ובשמים מזון והבדלה ב"ש אומרים שברא מאור האש וב"ה אומרים בורא מאורי האש אין מברכין לא על הנר ולא על הבשמים של <עכו"ם> {גוים} ולא על הנר ולא על הבשמים של מתים ולא על הנר ולא על הבשמים של ע"ז ואין מברכין על הנר עד שיאותו לאורו מי שאכל ושכח ולא בירך ב"ש אומרים יחזור למקומו ויברך וב"ה אומרים יברך במקום שנזכר ועד מתי מברך עד כדי שיתעכל המזון שבמעיו בא להן יין אחר המזון אם אין שם אלא אותו כוס בית שמאי אומרים מברך על היין ואח"כ מברך על המזון ובית הלל אומרים מברך על המזון ואח"כ מברך על היין ועונין אמן אחר ישראל המברך ואין עונין אמן אחר כותי המברך עד שישמע כל הברכה כולה:
מועד	שבת	א	34	הרואה מקום שנעשו בו נסים לישראל אומר ברוך שעשה נסים לאבותינו במקום הזה מקום שנעקרה ממנו <עכו"ם> {עבודה זרה} אומר ברוך שעקר <עכו"ם> {עבודה זרה} מארצנו על הזיקין ועל הזועות ועל הרעמים ועל הרוחות ועל הברקים אומר ברוך שכחו וגבורתו מלא עולם על ההרים ועל הגבעות ועל הימים ועל הנהרות ועל המדברות אומר ברוך עושה בראשית רבי יהודה אומר הרואה את הים הגדול אומר ברוך שעשה את הים הגדול בזמן שרואהו לפרקים על הגשמים ועל בשורות טובות אומר ברוך הטוב והמטיב על בשורות רעות אומר ברוך דיין האמת בנה בית חדש וקנה כלים חדשים אומר ברוך שהחיינו וקיימנו והגיענו לזמן הזה מברך על הרעה מעין על הטובה ועל הטובה מעין על הרעה והצועק לשעבר הרי זו תפלת שוא היתה אשתו מעוברת ואומר יהי רצון שתלד אשתי זכר הרי זו תפלת שוא היה בא בדרך ושמע קול צוחה בעיר ואומר יהי רצון שלא תהא בתוך ביתי הרי זו תפלת שוא הנכנס לכרך מתפלל שתים אחת בכניסתו ואחת ביציאתו בן עזאי אומר ארבע שתים בכניסתו ושתים ביציאתו נותן הודאה על שעבר וצועק על העתיד חייב אדם לברך על הרעה כשם שמברך על הטובה שנאמר (דברים ו) ואהבת את ה' אלהיך בכל לבבך וגו' בכל לבבך בשני יצריך ביצר טוב וביצר הרע ובכל נפשך אפילו הוא נוטל את נפשך ובכל מאדך בכל ממונך ד"א בכל מאדך בכל מדה ומדה שהוא מודד לך הוי מודה לו לא יקל אדם את ראשו כנגד שער המזרח שהוא מכוון כנגד בית קדשי הקדשים ולא יכנס להר הבית במקלו ובמנעלו ובפונדתו ובאבק שעל רגליו ולא יעשנו קפנדריא ורקיקה מקל וחומר כל חותמי ברכות שבמקדש היו אומרים עד העולם משקלקלו <הצדוקים> {המינים} ואמרו אין עולם אלא אחד התקינו שיהו אומרים מן העולם ועד העולם והתקינו שיהא אדם שואל את שלום חברו בשם שנאמר (רות ב) והנה בעז בא מבית לחם ויאמר לקוצרים ה' עמכם ויאמרו לו יברכך ה' ואומר (שופטים ו) ה' עמך גבור החיל ואומר (משלי כג) אל תבוז כי זקנה אמך ואומר (תהילים קיט) עת לעשות לה' הפרו תורתך רבי נתן אומר הפרו תורתך משום עת לעשות לה':
מועד	שבת	א	35	יציאות השבת שתים שהן ארבע בפנים ושתים שהן ארבע בחוץ כיצד העני עומד בחוץ ובעל הבית בפנים פשט העני את ידו לפנים ונתן לתוך ידו של בעל הבית או שנטל מתוכה והוציא העני חייב ובעל הבית פטור:  פשט בעל הבית את ידו לחוץ ונתן לתוך ידו של עני או שנטל מתוכה והכניס בעל הבית חייב והעני פטור:  פשט העני את ידו לפנים ונטל בעל הבית מתוכה או שנתן לתוכה והוציא שניהם פטורין פשט בעל הבית את ידו לחוץ ונטל העני מתוכה או שנתן לתוכה והכניס שניהם פטורין:
מועד	שבת	א	36	לא ישב אדם לפני הספר סמוך למנחה עד שיתפלל לא יכנס אדם למרחץ ולא לבורסקי ולא לאכול ולא לדין ואם התחילו אין מפסיקין מפסיקין <לקרות ק"ש> [לק"ש] ואין מפסיקין לתפלה:
מועד	שבת	א	37	לא יצא החייט במחטו סמוך לחשכה שמא ישכח ויצא ולא הלבלר בקולמוסו ולא יפלה את כליו ולא יקרא לאור הנר באמת אמרו החזן רואה היכן תינוקות קוראין אבל הוא לא יקרא כיוצא בו לא יאכל הזב עם הזבה מפני הרגל עבירה:
מועד	שבת	א	38	ואלו מן ההלכות שאמרו בעליית חנניה בן חזקיה בן גרון שעלו לבקרו נמנו ורבו ב"ש על ב"ה וי"ח דברים גזרו בו ביום:
מועד	שבת	א	39	ב"ש אומרים אין שורין דיו וסמנים וכרשינין אלא כדי שישורו מבעוד יום וב"ה מתירין ב"ש אומרים אין נותנין אונין של פשתן לתוך התנור אלא כדי שיהבילו מבעוד יום ולא את הצמר ליורה אלא כדי שיקלוט העין ובית הלל מתירין ב"ש אומרים אין פורסין מצודות חיה ועופות ודגים אלא כדי שיצודו מבעוד יום וב"ה מתירין ב"ש אומרים אין מוכרין לנכרי ואין טוענין עמו ואין מגביהין עליו אלא כדי שיגיע למקום קרוב ובית הלל מתירין בית שמאי אומרים אין נותנין עורות לעבדן ולא כלים לכובס נכרי אלא כדי שיעשו מבעוד יום ובכולן בית הלל מתירין עםהשמש אמר רשב"ג נוהגין היו בית אבא שהיו נותנין כלי לבן לכובס נכרי שלשה ימים קודם לשבת ושוין אלו ואלו שטוענין קורת בית הבד ועגולי הגת:
מועד	שבת	ב	40	אין צולין בשר בצל וביצה אלא כדי שיצולו מבעוד יום אין נותנין פת לתנור עם חשכה ולא חררה על גבי גחלים אלא כדי שיקרמו פניה מבעוד יום רא"א כדי שיקרום התחתון שלה משלשלין את הפסח בתנור עם חשכה ומאחיזין את האור במדורת בית המוקדובגבולין כדי שתאחוז האור ברובו ר' יהודה אומר בפחמין כל שהוא:
מועד	שבת	ב	41	במה מדליקין ובמה אין מדליקין אין מדליקין לא בלכש ולא בחוסן ולא בכלך ולא בפתילת האידן ולא בפתילת המדבר ולא בירוקה שעל פני המים ולא בזפת ולא בשעוה ולא בשמן קיק ולא בשמן שריפה ולא באליה ולא בחלב נחום המדי אומר מדליקין בחלב מבושל וחכ"א אחד מבושל ואחד שאינו מבושל אין מדליקין בו:
מועד	שבת	ב	42	אין מדליקין בשמן שריפה ביו"ט רבי ישמעאל אומר אין מדליקין בעטרן מפני כבוד השבת וחכמים מתירין בכל השמנים בשמן שומשמין בשמן אגוזים בשמן צנונות בשמן דגים בשמן פקועות בעטרן ובנפט ר' טרפון אומר אין מדליקין אלא בשמן זית בלבד:
מועד	שבת	ב	43	כל היוצא מן העץ אין מדליקין בו אלא פשתן וכל היוצא מן העץ אינו מטמא טומאת אהלים אלא פשתן:
מועד	שבת	ב	44	פתילת הבגד שקפלה ולא הבהבה ר"א אומר טמאה היא ואין מדליקין בה רע"א טהורה היא ומדליקין בה:
מועד	שבת	ב	45	לא יקוב אדם שפופרת של ביצה וימלאנה שמן ויתננה על פי הנר בשביל שתהא מנטפת ואפילו היא של חרס ורבי יהודה מתיר אבל אם חברה היוצר מתחילה מותר מפני שהוא כלי אחד לא ימלא אדם קערה של שמן ויתננה בצד הנר ויתן ראש הפתילה בתוכה בשביל שתהא שואבת ורבי יהודה מתיר:
מועד	שבת	ב	46	המכבה את הנר מפני שהוא מתירא מפני נכרים ומפני ליסטי' מפני רוח רעה מפני החולה שיישן פטור כחס על הנר כחס על השמן כחס על הפתילה חייב רבי יוסי פוטר בכולן חוץ מן הפתילה מפני שהוא עושה פחם:
מועד	שבת	ב	47	על שלש עבירות נשים מתות בשעת לידתן על שאינן זהירות בנדה בחלה ובהדלקת הנר:
