קודשים	זבחים	ד	1556	ואלו דברים שאין חייבין עליהם משום פיגול הקומץ והקטרת והלבונהומנחת כהנים ומנחת כהן משיח והדם והנסכים הבאין בפני עצמן דברי רבי מאיר וחכמים אומרים אף הבאין עם הבהמה לוג שמן של מצורע ר' שמעון אומר אין חייבין עליו משום פיגול ורבי מאיר אומר חייבין עליו משום פיגול שדם האשם מתירו וכל שיש לו מתירין בין לאדם בין למזבח חייבין עליו משום פיגול העולה דמה מתיר את בשרה למזבח ועורה לכהנים עולת העוף דמה מתיר את בשרה למזבח חטאת העוף דמה מתיר את בשרה לכהנים פרים הנשרפים ושעירים הנשרפים דמן מתיר את אימוריהן ליקרב ר' שמעון אומר כל שאינו על המזבח החיצון כשלמים אין חייבין עליו משום פיגול:
קודשים	זבחים	ד	1557	קדשי <עובדי כוכבים> {גוים} אין חייבין עליהן משום פיגול נותר וטמא והשוחטן בחוץ פטור דברי רבי שמעון רבי יוסי מחייב:
קודשים	זבחים	ד	1558	דברים שאין חייבים עליהם משום פיגול חייבין עליהן משום נותר ומשום טמא חוץ מן הדם ר' שמעון מחייב בדבר שדרכן לאכול אבל העצים והלבונה והקטורת אין חייבין עליו משום טומאה:
קודשים	זבחים	ה	1559	לשם ששה דברים הזבח נזבח לשם זבח לשם זובח לשם השם לשם אשים לשם ריח לשם ניחוח והחטאת והאשם לשם חטא אמר רבי יוסי אף מי שלא היה בלבו לשם אחד מכל אלו כשר שהוא תנאי בית דין שאין המחשבה הולכת אלא אחר העובד:
קודשים	זבחים	ה	1560	איזהו מקומן של זבחים קדשי קדשים שחיטתן בצפון פר ושעיר של יום הכיפורים שחיטתן בצפון וקיבול דמן בכלי שרת בצפון ודמן טעון הזיה על בין הבדים ועל הפרוכת ועל מזבח הזהב מתנה אחת מהן מעכבת שירי הדם היה שופך על יסוד מערבי של מזבח החיצון ואם לא נתן לא עכב:  פרים הנשרפים ושעירים הנשרפים שחיטתן בצפון וקיבול דמן בכלי שרת בצפון ודמן טעון הזיה על הפרוכת ועל מזבח הזהבמתנה אחת מהן מעכבת שירי הדם היה שופך על יסוד מערבי של מזבח החיצון ואם לא נתן לא עיכב אלו ואלו נשרפין אבית הדשן:
קודשים	זבחים	ה	1561	חטאות הצבור והיחיד אלו הן חטאות הצבור שעירי ראשי חדשים ושל מועדות שחיטתן בצפון וקיבול דמן בכלי שרת בצפון ודמן טעון ארבע מתנות על ארבע קרנות כיצדעלה בכבש ופנה לסובב ובא לו לקרן דרומית מזרחית מזרחית צפונית צפונית מערבית מערבית דרומית שירי הדם היה שופך על יסוד דרומית ונאכלין לפנים מן הקלעים לזכרי כהונה בכל מאכל ליום ולילה עד חצות:
קודשים	זבחים	ה	1562	העולה קדשי קדשים שחיטתה בצפון וקיבול דמה בכלי שרת בצפון ודמה טעון שתי מתנות שהן ארבע וטעונה הפשט וניתוח וכליל לאשים:
קודשים	זבחים	ה	1563	זבחי שלמי צבור ואשמות אלו הן אשמות אשם גזילות אשם מעילות אשם שפחה חרופה אשם נזיר אשם מצורע אשם תלוי שחיטתן בצפון וקיבול דמן בכלי שרת בצפון ודמן טעון שתי מתנות שהן ארבע ונאכלין לפנים מן הקלעים לזכרי כהונה לכל מאכל ליום ולילה עד חצות:
קודשים	זבחים	ה	1564	התודה ואיל נזיר קדשים קלים שחיטתן בכל מקום בעזרה ודמן טעון שתי מתנות שהן ארבע ונאכלין בכל העיר לכל אדם בכל מאכל ליום ולילה עד חצות המורם מהם כיוצא בהן אלא שהמורם נאכל לכהנים לנשיהם ולבניהם ולעבדיהם:
קודשים	זבחים	ה	1565	שלמים קדשים קלים שחיטתן בכל מקום בעזרה ודמן טעון שתי מתנות שהן ארבע ונאכלין בכל העיר לכל אדם בכל מאכל לשני ימים ולילה אחד המורם מהם כיוצא בהם אלא שהמורם נאכל לכהנים לנשיהם ולבניהם ולעבדיהם:
קודשים	זבחים	ו	1566	הבכור והמעשר והפסח קדשים קלים שחיטתן בכל מקום בעזרה ודמן טעון מתנה אחת ובלבד שיתן כנגד היסוד שינה באכילתן הבכור נאכל לכהנים והמעשר לכל אדם ונאכלין בכל העיר בכל מאכל לשני ימים ולילה אחד הפסח אינו נאכל אלא בלילה ואינו נאכל אלא עד חצות ואינו נאכל אלא למנויו ואינו נאכל אלא צלי:
קודשים	זבחים	ו	1567	קדשי קדשים ששחטן בראש המזבח רבי יוסי אומר כאילו נשחטו בצפון ר' יוסי בר' יהודה אומר מחצי המזבח ולדרום כדרום מחצי המזבח ולצפון כצפון:
קודשים	זבחים	ו	1568	מנחות היו נקמצות בכל מקום בעזרה ונאכלות לפנים מן הקלעים לזכרי כהונה בכל מאכל ליום ולילה עד חצות:
קודשים	זבחים	ו	1569	חטאת העוף היתה נעשית על קרן דרומית מערבית ובכל מקום היתה כשירה אלא זה היתה מקומה ושלשה דברים היתה אותה קרן משמשת מלמטה ושלשה מלמעלה מלמטה חטאת העוף והגשות ושירי הדם ומלמעלן ניסוך היין והמים ועולת העוף כשהיא רבה במזרח כל העולין למזבח עולין דרך ימיןומקיפין ויורדין דרך שמאל חוץ מן העולה לג' אלו שהיו עולין ויורדין על העקב:
קודשים	זבחים	ו	1570	חטאת העוף כיצד היה נעשית <עלה לכבש ופנה לסובב בא לו לקרן דרומית מזרחית> היה מולק את ראשה ממול ערפה ואינו מבדיל ומזה מדמה על קיר המזבח שירי הדם היה מתמצה על היסוד ואין למזבח אלא דמה וכולה לכהנים:
קודשים	זבחים	ז	1571	עולת העוף כיצד נעשית עלה לכבש ופנה לסובב בא לו לקרן דרומית מזרחית היה מולק את ראשה ממול ערפה ומבדיל ומיצה את דמה על קיר המזבח נטל את הראש והקיף בית מליקתו למזבח וספגו במלח וזרקו על גבי האשים בא לו לגוף והסיר את המוראה ואת הנוצה ואת בני המעיים היוצאין עמם והשליכן לבית הדשן שיסע ולא הבדיל ואם הבדיל כשר סופגו במלח וזרקו על גבי האשים לא הסיר המוראה ולא הנוצה ואת בני מעיים היוצאין עמם ולא ספגו במלח כל ששינה בה מאחר שמיצה את דמה כשירה הבדיל בחטאת ולא הבדיל בעולה פסול מיצה את דם הראש ולא מיצה דם הגוף פסולה דם הגוף ולא מיצה דם הראש כשירה חטאת העוף שמלקה שלא לשמה מיצה דמה שלא לשמה לשמה ושלא לשמה או שלא לשמה ולשמה פסול עולת העוף כשירה ובלבד שלא עלתה לבעלים לשם חובה אחד חטאת העוף ואחד עולת העוף שמלקן ושמיצה את דמן לאכול דבר שדרכו לאכול ולהקטיר דבר שדרכו להקטיר חוץ למקומו פסול ואין בו כרת חוץ לזמנו פיגול וחייבין עליו כרת ובלבד שיקריב המתיר כמצותו כיצד קרב המתיר כמצותו מלק בשתיקה ומיצה הדם חוץ לזמנו או שמלק חוץ לזמנו ומיצה הדם בשתיקה או שמלק ומיצה הדם חוץ לזמנו זהו שקרב המתיר כמצותו כיצד לא קרב המתיר כמצותו מלק חוץ למקומו מיצה הדם חוץ לזמנו או שמלק חוץ לזמנו ומיצה הדם חוץ למקומו או שמלק ומיצה הדם חוץ למקומוחטאת העוף שמלקו שלא לשמה ומיצה הדם חוץ לזמנו או שמלק חוץ לזמנו ומיצה דמו שלא לשמה או שמלק ומיצה הדם שלא לשמה זהו שלא קרב המתיר כמצותו לאכול כזית בחוץ כזית למחר כזית למחר כזית בחוץ כחצי זית בחוץ כחצי זית למחר כחצי זית למחר כחצי זית בחוץ פסול ואין בו כרת א"ר יהודה זה הכלל אם מחשבת הזמן קדמה למחשבת המקום פיגול וחייבין עליו כרת ואם מחשבת המקום קדמה למחשבת הזמן פסול ואין בו כרת [וחכ"א זה וזה פסול ואין בו כרת] לאכול כחצי זית ולהקטיר כחצי זית כשר שאין אכילה והקטרה מצטרפין:
קודשים	זבחים	ז	1572	חטאת העוף שעשאה למטה כמעשה חטאת לשם חטאת כשירה כמעשה חטאת לשם עולה כמעשה עולה לשם חטאת כמעשה עולה לשם עולה פסולה עשאה למעלה כמעשה כולן פסולה עולת העוף שעשאה למעלה כמעשה עולה לשם עולה כשירה כמעשה עולה לשם חטאת כשירה ובלבד שלא עלתה לבעליה כמעשה חטאת לשם עולה כמעשה חטאת לשם חטאת פסולה עשאה למטה כמעשה כולן פסולה:
קודשים	זבחים	ז	1573	וכולן אין מטמאין בבית הבליעה ומועלים בהן חוץ מחטאת העוף שעשאה למטה כמעשה חטאת לשם חטאת עולת העוף שעשאה למטה כמעשה חטאת לשם חטאת ר"א אומר מועלים בה ר' יהושע אומר אין מועלים בה א"ר אליעזר ומה אם חטאת שאין מועלים בה לשמה כששינה את שמה מועלים בה עולה שמועלים בה לשמה כששינה את שמה אינו דין שימעלו בה א"ל ר' יהושע לא אם אמרת בחטאת ששינה את שמה לשם עולה שכן שינה את שמה לדבר שיש בו מעילה תאמר בעולה ששינה את שמה לשם חטאת שכן שינה את שמה לדבר שאין בו מעילהאמר לו ר' אליעזר והרי קדשי קדשים ששחטן בדרום ושחטן לשם קדשים קלים יוכיחו שכן שינה את שמם לדבר שאין בו מעילה ומועלין בהן אף אתה אל תתמה על העולה אע"פ ששינה שמה לדבר שאין בו מעילה שימעלו בה אמר לו ר' יהושע לא אם אמרת בקדשי קדשים ששחטן בדרום ושחטן לשם קדשים קלים שכן שינה את שמם לדבר שיש בו איסור והיתר תאמר בעולה ששינה את שמה לדבר שכולו היתר:
קודשים	זבחים	ז	1574	<כל הפסולין שמלקו מליקתן פסולה ואינו מטמא בבית הבליעה> מלק בשמאל או בלילה שחט חולין בפנים וקדשים בחוץ אינן מטמאות בבית הבליעה מלק בסכין מלק חולין בפנים וקדשים בחוץתורין שלא הגיע זמנן ובני יונה שעבר זמנן שיבשה גפה שניסמית עינה ושנקטעה רגלה מטמא בבית הבליעה זה הכלל כל שפסולו בקודש אינו מטמא בבית הבליעה לא היה פסולו בקודש מטמא בבית הבליעה:
קודשים	זבחים	ח	1575	מלק ונמצאת טריפה ר' מאיר אומר אינו מטמא בבית הבליעהרבי יהודה אומר מטמא א"ר מאיר ק"ו אם נבלת בהמה שמטמאה במגע ובמשא שחיטתה מטהרת טריפתה מטומאתה נבלת העוף שאינו מטמא במגע ובמשא אינו דין שתהא שחיטתו מטהרת טריפתו מטומאתו מה מצינו בשחיטתו שהיא מכשרתה לאכילה ומטהרת טריפתו מטומאתו אף מליקתו שהיא מכשרתו באכילה תטהר טריפתו מידי טומאתו רבי יוסי אומר דיה כנבלת בהמה שחיטתה מטהרתה ולא מליקתה:
קודשים	זבחים	ח	1576	כל הזבחים שנתערבו בחטאות המתות או בשור הנסקל אפילו אחת בריבוא ימותו כולן נתערבו בשור שנעבדה בו עבירה אושהמית את האדם ע"פ עד א' או ע"פ הבעלי' ברובע ונרבע במוקצה ונעבד באתנן ומחירבכלאים ובטריפה ביוצא דופן ירעו עד שיסתאבו וימכרו ויביא בדמי היפה שבהן מאותו המין נתערבו בחולין תמימים ימכרו החולין לצורכי אותו המין קדשים בקדשים מין במינו [זה יקרב לשם מי שהוא וזה] יקרב לשם מי שהוא קדשים בקדשים מין בשאינו מינו ירעו עד שיסתאבו <וימכרו> ויביא בדמי יפה שבהן ממין זה ובדמי היפה שבהן ממין זה ויפסיד המותר מביתו נתערבו בבכור ובמעשר ירעו עד שיסתאבו ויאכלו כבכור וכמעשר הכל יכולין להתערב חוץ מן החטאת והאשם:
קודשים	זבחים	ח	1577	אשם שנתערב בשלמים רבי שמעון אומר שניהם ישחטו בצפון ויאכלו כחמור שבהן אמרו לו אין מביאין קדשים לבית הפסול נתערבו חתיכות בחתיכות קדשי קדשים בקדשים קלים הנאכלין ליום אחד בנאכלין לשני ימים ולילה יאכלו כחמור שבהן:
קודשים	זבחים	ח	1578	איברי חטאת שנתערבו באיברי עולה ר' אליעזר אומר יתן למעלה ורואה אני את בשר החטאת מלמעלה כאילו הן עצים וחכמים אומרים תעובר צורתן ויצאו לבית השריפה:
קודשים	זבחים	ח	1579	אברין באברין בעלי מומין ר"א אומר אם קרב ראש אחד מהן יקרבו כל הראשין כרעים של אחד מהן יקרבו כל הכרעים וחכ"א אפי' קרבו כלם חוץ מאחד מהן יצא לבית השריפה:
קודשים	זבחים	ח	1580	דם שנתערב במים אם יש בו מראית דם כשר נתערב ביין רואין אותו כאילו הוא מים נתערב בדם בהמה או בדם החיה רואין אותו כאילו הוא מיםרבי יהודה אומר אין דם מבטל דם נתערב בדם פסולין ישפך לאמה בדם התמצית ישפך לאמה רבי אליעזר מכשיר אם לא נמלך ונתן כשר:
קודשים	זבחים	ח	1581	דם תמימים בדם בעלי מומין ישפך לאמה כוס בכוסות רבי אליעזר אומר אם קרב כוס אחד יקרבו כל הכוסות וחכמים אומרים אפילו קרבו כולן חוץ מאחד מהן ישפך לאמה הניתנין למטה שנתערבו בניתנין למעלה רבי אליעזר אומר יתן למעלה ורואה אני את התחתונים מלמעלן כאילו הם מים ויחזור ויתן למטה וחכמים אומרים ישפך לאמה ואם לא נמלך ונתן כשרהניתנין במתנה אחת שנתערבו בניתנין במתנה אחת ינתנו במתנה אחת <מהן> מתן ארבע במתן ארבע ינתנו במתן ארבע מתן ארבע במתנה אחת ר"א אומר ינתנו במתן ארבע ר' יהושע אומר ינתנו במתנה אחת אמר לו רבי אליעזר הרי הוא עובר על בל תגרע אמר ליה רבי יהושע הרי הוא עובר על בל תוסיף א"ל רבי אליעזר לא נאמר בל תוסיף אלא כשהוא בעצמו א"ל ר' יהושע לא נאמר בל תגרע אלא כשהוא בעצמו ועוד א"ר יהושע כשנתת עברת על בל תוסיף ועשית מעשה בידך כשלא נתת עברת על בל תגרע ולא עשית מעשה בידך:
קודשים	זבחים	ח	1582	הניתנין בפנים שנתערבו בניתנין בחוץ ישפכו לאמה נתן בחוץ וחזר ונתן בפנים כשר בפנים וחזר ונתן בחוץ רבי עקיבא פוסל וחכמים מכשירים שר"ע אומר כל דמים שנכנסו לכפר בהיכל פסולין וחכמים אומרים חטאת בלבד רבי אליעזר אומר אף האשם שנאמר (ויקרא ו) כחטאת כאשם:
קודשים	זבחים	ט	1583	חטאת שקבל דמה בשני כוסות יצא אחד מהן לחוץ הפנימי כשר נכנס אחד מהם לפנים ר' יוסי הגלילי מכשיר בחיצון וחכמים פוסלין א"ר יוסי הגלילי מה אם במקום שהמחשבה פוסלת בחוץ לא עשה את המשויר כיוצא מקום שאין המחשבה פוסלת בפנים אינו דין שלא נעשה את המשויר כנכנס נכנס לכפר אע"פ שלא כפר פסול דברי ר"א ר"ש אומר עד שיכפר רבי יהודה אומר אם הכניס שוגג כשר כל הדמים פסולין שנתנו ע"ג המזבח לא הרצה הציץ אלא על הטמא שהציץ מרצה על הטמא ואינו מרצה על היוצא:
קודשים	זבחים	ט	1584	המזבח מקדש [את] הראוי לו רבי יהושע אומר כל הראוי לאישים אם עלה לא ירד שנאמר (ויקרא ו) היא העולה על מוקדה מה עולה שהיא ראויה לאישים אם עלתה לא תרד אף כל שהוא ראוי לאישים אם עלה לא ירד רבן גמליאל אומר כל הראוי למזבח אם עלה לא ירד שנאמר היא העולה על מוקדה על המזבח מה עולה שהיא ראויה למזבח אם עלתה לא תרד אף כל דבר שהוא ראוי למזבח אם עלתה לא תרד אין בין דברי רבן גמליאל לדברי רבי יהושע אלא הדם והנסכים שרבן גמליאל אומר לא ירדו ורבי יהושע אומר ירדו רבי שמעון אומר הזבח כשר ונסכים פסולין הנסכים כשירים והזבח פסול אפי' זה וזה פסולין הזבח לא ירד והנסכים ירדו:
קודשים	זבחים	ט	1585	אלו אם עלו לא ירדו הלן והיוצא והטמא ושנשחט חוץ לזמנו וחוץ למקומו ושקבלו פסולין וזרקו את דמו רבי יהודה אומר שנשחט בלילה ונשפך דמה ויצא דמה חוץ לקלעים אם עלתה תרד ר"ש אומר לא תרד <שהיה פסולו בקדש> שר"ש אומר כל שפסולו בקדש הקדש מקבלו לא היה פסולו בקדש אין הקדש מקבלו ואלו שלא היו פסולן בקדש הרובע והנרבע והמוקצה והנעבד והאתנן והמחיר והכלאים והטרפה והיוצא דופן ובעלי מומין ר"ע מכשיר בבעלי מומין רבי חנינא סגן הכהנים אומר דוחה היה אבא את בעלי מומין מע"ג המזבח כשם שאם עלו לא ירדו כך אם ירדו לא יעלו וכולן שעלו חיים לראש המזבח ירדו עולה שעלתה חיה לראש המזבח תרד שחטה בראש המזבח יפשיט וינתחה במקומה:
קודשים	זבחים	ט	1586	ואלו אם עלו ירדו בשר קדשי קדשים ובשר קדשים קלים ומותר העומר ושתי הלחם ולחם הפנים ושירי מנחות והקטורת הצמר שבראשי כבשים ושער שבזקן תישים והעצמות והגידים והקרנים והטלפים בזמן שהם מחוברים יעלו שנאמר (ויקרא א) והקטיר הכהן את הכל פירשו לא יעלו שנאמר (דברים יב) ועשית עולותיך הבשר והדם:
קודשים	זבחים	ט	1587	וכולן שפקעו מעל גבי המזבח לא יחזיר וכן גחלת שפקעה מעל גבי המזבח לא יחזיר איברים שפקעו מעל גבי המזבח קודם חצות יחזיר ומועלין בהן לאחר חצות לא יחזיר ואין מועלין בהם כשם שהמזבח מקדש את הראוי לו כך הכבש מקדש כשם שהמזבח והכבש מקדשין את הראוי להן כך הכלים מקדשין:
קודשים	זבחים	י	1588	כלי הלח מקדשין את הלח ומדות יבש מקדשות את היבש אין כלי הלח מקדשת את היבש ולא יבש מקדש את הלח כלי הקודש שניקבו אם עושין בהן מעין מלאכתן שהיו עושין והן שלימים מקדשין ואם לאו אין מקדשין וכולן אין מקדשין אלא בקודש:
קודשים	זבחים	י	1589	כל התדיר מחבירו קודם את חבירו התמידין קודמין למוספין מוספי שבת קודמין למוספי ר"ח מוספי ר"ח קודמין למוספי ר"ה שנאמר (במדבר כח) מלבד עולת הבקר אשר לעולת התמיד תעשו את אלה:
קודשים	זבחים	י	1590	כל המקודש מחבירו קודם את חבירו דם החטאת קודם לדם העולה מפני שהוא מרצה איברי עולה קודמין לאימורי חטאת מפני שהוא כליל לאישים חטאת קודמת לאשם מפני שדמה ניתן לד' קרנות על היסוד אשם קודם לתודה ואיל נזיר מפני שהוא קדשי קדשים תודה ואיל נזיר קודמים לשלמים מפני שהן נאכלין ליום אחד וטעונין לחם השלמים קודמין לבכור מפני שהן טעונין מתן ד' [וסמיכה] ונסכים ותנופות חזה ושוק הבכור קודם למעשר מפני שקדושתו מרחם ונאכל לכהנים המעשר קודם לעופות מפני שהוא זבח ויש בו קודש קדשים דמו ואימוריו העופות קודמין למנחות מפני שהן מיני דמים מנחת חוטא קודם למנחת נדבה מפני שהוא בא על חטא חטאת העוף קודמת לעולת העוף וכן בהקדישה:
קודשים	זבחים	י	1591	כל החטאות שבתורה קודמות לאשמות חוץ מאשם מצורע מפני שהוא בא על הכשר כל האשמות שבתורה באין בני שתים ובאין בכסף שקלים חוץ מאשם נזיר ואשם מצורע שהן באין בני שנתן ואין באין בכסף שקלים כשם שקודמין בהקרבתן קודמין באכילתן שלמים של אמש ושלמים של יום של אמש קודמין לשל יום שלמים של אמש חטאת ואשם של היום שלמים של אמש קודמין דברי ר"מ וחכ"א חטאת קודמת מפני שהיא קדשי קדשים וכולן הכהנים רשאין לשנות באכילתן לאכלן צלוין ושלוקין ומבושלין לתת לתוכו תבלי חולין ותבלי תרומה דברי ר"ש ר"מ אומר לא יתן לתוכו תבלי תרומה שלא יביא התרומה לידי פסול:
קודשים	זבחים	יא	1592	אמר רבי שמעון אם ראית שמן שהוא מתחלק בעזרה אין צריך לשאול מהו אלא מותר רקיקי מנחות ישראל ולוג שמן של מצורע אם ראית שמן שהוא ניתן על גבי האישים אין צריך לשאול מהו אלא מותר רקיקי מנחת כהנים ומנחת כהן משיח שאין מתנדבין שמן רבי טרפון אומר מתנדבין שמן:
קודשים	זבחים	יא	1593	דם חטאת שנתז על הבגד הרי זה טעון כיבוס אע"פ שאין הכתוב מדבר אלא בנאכלות שנאמר (ויקרא ו) במקום קדוש תאכל אחד הנאכלות ואחד הפנימיות טעונות כיבוס שנאמר תורת החטאת תורה אחת לכל החטאות חטאת פסולה אין דמה טעון כיבוס בין שהיתה לה שעת הכושר ובין שלא היתה לה שעת הכושר איזו היא שהיתה לה שעת הכושר שלנה ושנטמאה ושיצאת ואיזו היא שלא היתה לה שעת הכושר שנשחטה חוץ לזמנה וחוץ למקומה ושקיבלו פסולין <וזרקו> את דמה:
