נזיקין	בבא קמא	ו	1119	הכונס צאן לדיר ונעל בפניה כראוי ויצאה והזיקה פטור לא נעל בפניה כראוי ויצאה והזיקה חייב נפרצה בלילה או שפרצוה לסטים ויצאה והזיקה פטור הוציאוה לסטים לסטים חייבין הניחה בחמה או שמסרה לחרש שוטה וקטן ויצאה והזיקה חייב מסרה לרועה נכנס הרועה תחתיו נפלה לגינה ונהנית משלמת מה שנהנית ירדה כדרכה והזיקה משלמת מה שהזיקה כיצד משלמת מה שהזיקה שמין בית סאה באותה שדה כמה היתה יפה וכמה היא יפה ר' שמעון אומר אכלה פירות גמורים משלמת פירות גמורים אם סאה סאה אם סאתים סאתים:
נזיקין	בבא קמא	ו	1120	המגדיש בתוך שדה חבירו שלא ברשות ואכלתן בהמתו של בעל השדה פטור ואם הוזקה בהן בעל הגדיש חייב ואם הגדיש ברשות בעל השדה חייב:
נזיקין	בבא קמא	ו	1121	השולח את הבערה ביד חרש שוטה וקטן פטור בדיני אדם וחייב בדיני שמים שלח ביד פקח הפקח חייב אחד הביא את האור ואחד הביא את העצים המביא את העצים חייב אחד הביא את העצים ואחד הביא את האור המביא את האור חייב בא אחר וליבה המלבה חייב ליבתה הרוח כולן פטורין:
נזיקין	בבא קמא	ו	1122	השולח את הבערה ואכלה עצים או אבנים או עפר חייב שנאמר (שמות כב) כי תצא אש ומצאה קוצים ונאכל גדיש או הקמה או השדה שלם ישלם המבעיר את הבערה:
נזיקין	בבא קמא	ו	1123	עברה גדר שהוא גבוה ד' אמות או דרך הרבים או נהר פטור:
נזיקין	בבא קמא	ו	1124	המדליק בתוך שלו עד כמה תעבור הדליקה רבי אלעזר בן עזריה אומר רואין אותו כאילו הוא באמצע בית כור ר"א אומר ט"ז אמות כדרך רה"ר רבי עקיבא אומר חמשים אמה ר"ש אומר (שמות כב) שלם ישלם המבעיר את הבערה הכל לפי הדליקה:
נזיקין	בבא קמא	ו	1125	המדליק את הגדיש והיו בו כלים ודלקו ר"י אומר משלם מה שבתוכו וחכ"א אינו משלם אלא גדיש של חטין או של שעורין היה גדי כפות לו ועבד סמוך לו ונשרף עמו חייב עבד כפות לו וגדי סמוך לו ונשרף עמו פטור ומודים חכמים לר"י במדליק את הבירה שהוא משלם כל מה שבתוכה שכן דרך בני אדם להניח בבתים:
נזיקין	בבא קמא	ז	1126	גץ שיצא מתחת הפטיש והזיק חייב גמל שהיה טעון פשתן ועבר ברשות הרבים ונכנס פשתנו לתוך החנות ודלקו בנרו של חנוני והדליק את הבירה בעל גמל חייב הניח חנוני נרו מבחוץ החנוני חייב רבי יהודה אומר בנר חנוכה פטור:
נזיקין	בבא קמא	ז	1127	מרובה מדת תשלומי כפל ממדת תשלומי ארבעה וחמשה שמדת תשלומי כפל נוהגת בין בדבר שיש בו רוח חיים ובין בדבר שאין בו רוח חיים ומדת תשלומי ארבעה וחמשה אינה נוהגת אלא בשור ושה בלבד שנאמר (שמות כא) כי יגנוב איש שור או שה וטבחו או מכרו וגו' אין הגונב אחר הגנב משלם תשלומי כפל ולא הטובח ולא המוכר אחר הגנב משלם תשלומי ארבעה וחמשה:
נזיקין	בבא קמא	ז	1128	גנב ע"פ שנים וטבח ומכר על פיהם או על פי שנים אחרים משלם תשלומי ארבעה וחמשה גנב ומכר בשבת גנב ומכר לע"ז גנב וטבח ביום הכפורים גנב משל אביו וטבח ומכר ואח"כ מת אביו גנב וטבח ואחר כך הקדיש משלם תשלומי ארבעה וחמשה גנב וטבח לרפואה או לכלבים השוחט ונמצאת טריפה השוחט חולין בעזרה משלם תשלומי ארבעה וחמשה רבי שמעון פוטר בשני אלו:
נזיקין	בבא קמא	ז	1129	גנב על פי שנים וטבח ומכר על פיהן ונמצאו זוממים משלמין הכל גנב על פי שנים וטבח ומכר על פי שנים אחרים אלו ואלו נמצאו זוממין הראשונים משלמין תשלומי כפל ואחרונים משלמין תשלומי ג' נמצאו אחרונים זוממין הוא משלם תשלומי כפל והן משלמין תשלומי ג' אחד מן אחרונים זוממין בטלה עדות שניה אחד מן הראשונים זוממין בטלה כל העדות שאם אין גניבה אין טביחה ואין מכירה:
נזיקין	בבא קמא	ז	1130	גנב ע"פ שנים וטבח ומכר ע"פ עד אחד או ע"פ עצמו משלם תשלומי כפל ואינו משלם תשלומי ד' וה' גנב וטבח בשבת גנב וטבח לע"ז גנב משל אביו ומת אביו ואח"כ טבח ומכר גנב והקדיש ואח"כ טבח ומכר משלם תשלומי כפל ואינו משלם תשלומי ד' וה' ר"ש אומר קדשים שחייב באחריותם משלם תשלומי ד' וה' שאין חייב באחריותם פטור:
נזיקין	בבא קמא	ז	1131	מכרו חוץ מאחד ממאה שבו או שהיתה לו בו שותפות השוחט ונתנבלה בידו הנוחר והמעקר משלם תשלומי כפל ואינו משלם תשלומי ארבעה וחמשה:
נזיקין	בבא קמא	ז	1132	גנב ברשות הבעלים וטבח ומכר חוץ מרשותם או שגנב חוץ מרשותם וטבח ומכר ברשותם או שגנב וטבח ומכר חוץ מרשותם משלם תשלומי ארבעה וחמשה אבל גנב וטבח ומכר ברשותם פטור היה מושכו ויוצא ומת ברשות הבעלים פטור הגביהו או הוציאו מרשות בעלים ומת חייב נתנו לבכורות בנו או לבעל חוב לשומר חנם לשואל לנושא שכר ולשוכר והיה מושכו ומת ברשות הבעלים פטור הגביהו או שהוציאו מרשות הבעלים ומת חייב:
נזיקין	בבא קמא	ח	1133	אין מגדלין בהמה דקה בא"י אבל מגדלין בסוריא ובמדברות של ארץ ישראל אין מגדלין תרנגולין בירושלים מפני הקדשים ולא כהנים בארץ ישראל מפני הטהרות אין מגדלין חזירין בכל מקום לא יגדל אדם את הכלב אלא אם כן היה קשור בשלשלת אין פורסין נישובים ליונים אלא אם כן היה רחוק מן הישוב ל' ריס:
נזיקין	בבא קמא	ח	1134	החובל בחבירו חייב עליו משום חמשה דברים בנזק בצער בריפוי בשבת ובושת:  בנזק כיצד סימא את עינו קטע את ידו שיבר את רגלו רואין אותו כאילו הוא עבד נמכר בשוק ושמין כמה היה יפה וכמה הוא יפה:  צער כואו <או> בשפוד או במסמר ואפילו על ציפורנו מקום שאינו עושה חבורה אומדין כמה אדם כיוצא בזה רוצה ליטול להיות מצטער כך:  ריפוי הכהו חייב לרפאותו עלה בו צמחים אם מחמת המכה חייב שלא מחמת המכה פטור חייתה ונסתרה חייתה ונסתרה חייב לרפאותו חייתה כל צורכה אינו חייב לרפאותו:  שבת רואין אותו כאילו הוא שומר קישואין שכבר נתן לו דמי ידו ודמי רגלו:  בושת הכל לפי המבייש והמתבייש:
נזיקין	בבא קמא	ח	1135	המבייש את הערום המבייש את הסומא והמבייש את הישן חייב וישן שבייש פטור נפל מן הגג והזיק ובייש חייב על הנזק ופטור על הבושת עד שיהא מתכוין:
נזיקין	בבא קמא	ח	1136	זה חומר באדם מבשור שהאדם משלם נזק צער ריפוי שבת ובושת ומשלם דמי ולדות ושור אינו משלם אלא נזק ופטור מדמי ולדות המכה את אביו ואת אמו ולא עשה בהן חבורה וחובל בחבירו ביום הכפורים חייב בכולן החובל בעבד עברי חייב בכולן חוץ מן השבת בזמן שהוא שלו החובל בעבד כנעני של אחרים חייב בכולן רבי יהודה אומר אין לעבדים בושת חש"ו פגיעתן רעה החובל בהן חייב והם שחבלו באחרים פטורין העבד והאשה פגיעתן רעה החובל בהם חייב והם שחבלו באחרים פטורין אבל משלמין לאחר זמן נתגרשה האשה נשתחרר העבד חייבין לשלם המכה אביו ואמו ועשה בהן חבורה והחובל בחבירו בשבת פטור מכולן מפני שהוא נדון בנפשו והחובל בעבד כנעני שלו פטור מכולן:
נזיקין	בבא קמא	ח	1137	התוקע לחבירו נותן לו סלע רבי יהודה אומר משום ר' יוסי הגלילי מנה סטרו נותן לו מאתים זוז לאחר ידו נותן לו ארבע מאות זוז צרם באזנו תלש בשערו רקק והגיע בו רוקו העביר טליתו ממנו פרע ראש האשה בשוק נותן לו ארבע מאות זוזזה הכלל הכל לפי כבודו אמר ר' עקיבא אפי' עניים שבישראל רואין אותם כאילו הם בני חורין שירדו מנכסיהם שהם בני אברהם יצחק ויעקב ומעשה באחד שפרע ראש האשה בשוק באת לפני רבי עקיבא וחייבו ליתן לה ארבע מאות זוז אמר לו רבי תן לי זמן ונתן לו זמן שמרה עומדת על פתח חצרה ושבר את הכד בפניה ובו כאיסר שמן גילתה את ראשה והיתה מטפחת ומנחת ידה על ראשה העמיד עליה עדים ובא לפני רבי עקיבא א"ל לזו אני נותן ד' מאות זוז א"ל לא אמרת כלום החובל בעצמו אף על פי שאינו רשאי פטור אחרים שחבלו בו חייבים והקוצץ נטיעותיו אף על פי שאינו רשאי פטור אחרים חייבין:
נזיקין	בבא קמא	ט	1138	אע"פ שהוא נותן לו אין נמחל לו עד שיבקש ממנו שנאמר (בראשית כ) ועתה השב אשת וגו' ומנין שאם לא מחל לו שהוא אכזרי שנאמר (בראשית כ) ויתפלל אברהם אל האלהים וירפא אלהים את אבימלך וגו' האומר סמא את עיני קטע את ידי שבר את רגלי חייב ע"מ לפטור חייב קרע את כסותי שבר את כדי חייב ע"מ לפטור פטור עשה כן לאיש פלוני על מנת לפטור חייב בין בגופו בין בממונו:
נזיקין	בבא קמא	ט	1139	הגוזל עצים ועשאן כלים צמר ועשאן בגדים משלם כשעת הגזלה גזל פרה מעוברת וילדה רחל טעונה וגזזה משלם דמי פרה העומדת לילד ודמי רחל העומדת ליגזז גזל פרה ונתעברה אצלו וילדה רחל ונטענה אצלו וגזזה משלם כשעת הגזלה זה הכלל כל הגזלנים משלמין כשעת הגזלה:
נזיקין	בבא קמא	ט	1140	גזל בהמה והזקינה עבדים והזקינו משלם כשעת הגזלה רבי מאיר אומר בעבדים אומר לו הרי שלך לפניך גזל מטבע ונסדק פירות והרקיבו יין והחמיץ משלם כשעת הגזלה מטבע ונפסל תרומה ונטמאת חמץ ועבר עליו הפסח בהמה ונתעבדה בה עבירה או שנפסלה מעל גבי המזבח או שהיתה יוצאה ליסקל אומר לו הרי שלך לפניך:
נזיקין	בבא קמא	ט	1141	נתן לאומנין לתקן וקלקלו חייבין לשלם נתן לחרש שידה תיבה ומגדל לתקן וקלקל חייב לשלם והבנאי שקיבל עליו לסתור את הכותל ושיבר האבנים או שהזיקן חייב לשלם היה סותר מצד זה ונפל מצד אחר פטור ואם מחמת המכה חייב:
נזיקין	בבא קמא	ט	1142	הנותן צמר לצבע והקדיחו יורה נותן לו דמי צמרו צבעו כאור אם השבח יתר על היציאה נותן לו את היציאה ואם היציאה יתירה על השבח נותן לו את השבח לצבוע לו אדום וצבעו שחור שחור וצבעו אדום רבי מאיר אומר נותן לו דמי צמרו ר' יהודה אומר אם השבח יתר על היציאה נותן לו את היציאה ואם היציאה יתירה על השבח נותן לו את השבח:
נזיקין	בבא קמא	ט	1143	הגוזל את חבירו שוה פרוטה ונשבע לו יוליכנו אחריו למדי לא יתן לא לבנו ולא לשלוחו אבל נותן לשליח בית דין ואם מת יחזיר ליורשיו נתן לו את הקרן ולא נתן לו את החומש מחל לו על הקרן ולא מחל לו על החומש מחל לו על זה ועל זה חוץ מפחות שוה פרוטה בקרן אינו צריך לילך אחריו נתן לו את החומש ולא נתן לו את הקרן מחל לו על החומש ולא מחל לו על הקרן מחל לו על זה ועל זה חוץ משוה פרוטה בקרן צריך לילך אחריו נתן לו את הקרן ונשבע לו על החומשהרי זה משלם חומש על חומש עד שיתמעט הקרן משוה פרוטה וכן בפקדון שנאמר (ויקרא ה) או בפקדון או בתשומת יד או בגזל או עשק את עמיתו או מצא אבידה וכחש בה ונשבע על שקר הרי זה משלם קרן וחומש ואשם:
נזיקין	בבא קמא	ט	1144	היכן פקדוני אמר לו אבד משביעך אני ואמר אמן והעדים מעידים אותו שאכלו משלם קרן [הודה מעצמו משלם קרן וחומש ואשם] היכן פקדוני אמר לו נגנב משביעך אני ואמר אמן והעדים מעידים אותו שגנבו משלם תשלומי כפל הודה מעצמו משלם קרן חומש ואשם הגוזל את אביו ונשבע לו ומת הרי זה משלם קרן וחומש ואשם לבניו או לאחיו ואם אינו רוצה או שאין לו לוה ובעלי חוב באין ונפרעים האומר לבנו קונם אי אתה נהנה משלי אם מת ירשנובחייו ובמותו אם מת לא ירשנו ויחזיר לבניו או לאחיו ואם אין לו לוה ובעלי חוב באים ונפרעים:
נזיקין	בבא קמא	י	1145	הגוזל את הגר ונשבע לו ומת הרי זה משלם קרן וחומש לכהנים ואשם למזבח שנאמר (במדבר ה) ואם אין לאיש גואל להשיב האשם אליו האשם המושב לה' לכהן מלבד איל הכפורים אשר יכפר בו עליו היה מעלה את הכסף ואת האשם ומת הכסף ינתן לבניו והאשם ירעה עד שיסתאב וימכר ויפלו דמיו לנדבה נתן הכסף לאנשי משמר ומת אין היורשין יכולין להוציא מידם שנאמר (במדבר ה) ואיש אשר יתן לכהן לו יהיה נתן הכסף ליהויריב ואשם לידעיה יצא אשם ליהויריב וכסף לידעיה אם קיים האשם יקריבוהו בני ידעיה ואם לא יחזיר ויביא אשם אחר שהמביא גזילו עד שלא הביא אשמו יצא הביא אשמו עד שלא הביא גזילו לא יצא נתן את הקרן ולא נתן את החומש אין החומש מעכב:
נזיקין	בבא קמא	י	1146	הגוזל ומאכיל את בניו והניח לפניהם פטורין מלשלם ואם היה דבר שיש בו אחריות חייבין לשלם:
נזיקין	בבא קמא	י	1147	אין פורטין לא מתיבת המוכסין ולא מכיס של גבאין ואין נוטלין מהם צדקה אבל נוטל הוא מתוך ביתו או מן השוק:
נזיקין	בבא קמא	י	1148	נטלו מוכסין את חמורו ונתנו לו חמור אחר נטלו לסטים את כסותו ונתנו לו כסות אחרת הרי אלו שלו מפני שהבעלים מתייאשין מהן:  המציל מן הנהר או מן הגייס או מן הלסטין אם נתייאשו הבעלים הרי אלו שלו וכן נחיל של דבורים אם נתייאשו הרי אלו שלו א"ר יוחנן בן ברוקה נאמנת אשה או קטן לומר מכאן יצא נחיל זה ומהלך בתוך שדה חבירו להציל את נחילו ואם הזיק משלם מה שהזיק אבל לא יקוץ את סוכו על מנת ליתן את הדמים ר' ישמעאל בנו של ר' יוחנן בן ברוקה אומר אף קוצץ ונותן את הדמים:
נזיקין	בבא קמא	י	1149	המכיר כליו וספריו ביד אחר ויצא לו שם גניבה בעיר ישבע לו לוקח כמה נתן ויטול ואם לאו לאו כל המנו שאני אומר מכרן לאחר ולקחן זה הימנו:
נזיקין	בבא קמא	י	1150	זה בא בחביתו של יין וזה בא בכדו של דבש נסדקה חבית של דבש ושפך זה את יינו והציל את הדבש לתוכואין לו אלא שכרו ואם אמר אציל את שלך ואתה נותן לי דמי שלי חייב ליתן לו שטף נחל חמורו וחמור חבירו שלו יפה מנה ושל חבירו מאתים והניח זה את שלו והציל את של חבירו אין לו אלא שכרו ואם אמר לו אני אציל את שלך ואתה נותן לי את שלי חייב ליתן לו:
נזיקין	בבא קמא	י	1151	הגוזל שדה מחבירו ונטלוה מסיקין אם מכת מדינה היא אומר לו הרי שלך לפניך אם מחמת הגזלן חייב להעמיד לו שדה אחר:
נזיקין	בבא קמא	י	1152	שטפה נהר אומר לו הרי שלך לפניך:
נזיקין	בבא קמא	י	1153	הגוזל את חבירו או שהלוה הימנו או שהפקיד לו בישוב לא יחזיר לו במדבר על מנת לצאת במדבר יחזיר לו במדבר:
נזיקין	בבא קמא	י	1154	האומר לחבירו גזלתיך הלויתני הפקדת אצלי ואיני יודע אם החזרתי לך אם לא החזרתי לך חייב לשלם אבל אם אמר לו איני יודע אם גזלתיך אם הלויתני אם הפקדת אצלי פטור מלשלם:
נזיקין	בבא קמא	י	1155	הגונב טלה מן העדר והחזירו ומת או נגנב חייב באחריותו לא ידעו בעלים לא בגניבתו ולא בחזירתו ומנו את הצאן ושלימה היא פטור:
נזיקין	בבא קמא	י	1156	אין לוקחין מן הרועים צמר וחלב וגדיים ולא משומרי פירות עצים ופירות אבל לוקחין מן הנשים כלי צמר ביהודה וכלי פשתן בגליל ועגלים בשרון וכולן שאמרו להטמין אסור ולוקחין ביצים ותרנגולין מכל מקום:
נזיקין	בבא מציעא	א	1157	מוכין שהכובס מוציא הרי אלו שלו והסורק מוציא הרי אלו של בעה"ב כובס נוטל ג' חוטין והן שלו יתר מכן הרי אלו של בעה"ב אם היה שחור ע"ג הלבן נוטל את הכל והן שלו החייט ששייר את החוט כדי לתפור בו ומטלית שהיא ג' על ג' הרי אלו של בעה"ב מה שהחרש מוציא במעצד הרי אלו שלו ובכשיל של בעל הבית ואם היה עושה אצל בעה"ב אף הנסרים של בעה"ב:
נזיקין	בבא מציעא	א	1158	שנים אוחזין בטלית זה אומר אני מצאתיה וזה אומר אני מצאתיה זה אומר כולה שלי וזה אומר כולה שלי זה ישבע שאין לו בה פחות מחציה וזה ישבע שאין לו בה פחות מחציה ויחלוקו זה אומר כולה שלי וזה אומר חציה שלי האומר כולה שלי ישבע שאין לו בה פחות משלשה חלקים והאומר חציה שלי ישבע שאין לו בה פחות מרביע זה נוטל שלשה חלקים וזה נוטל רביע היו שנים רוכבין על גבי בהמה או שהיה אחד רוכב ואחד מנהיג זה אומר כולה שלי וזה אומר כולה שלי זה ישבע שאין לו בה פחות מחציה וזה ישבע שאין לו בה פחות מחציה ויחלוקו בזמן שהם מודים או שיש להן עדים חולקין בלא שבועה:
נזיקין	בבא מציעא	א	1159	היה רוכב על גבי בהמה וראה את המציאה ואמר לחבירו תנה לי נטלה ואמר אני זכיתי בה זכה בה אם משנתנה לו אמר אני זכיתי בה תחלה לא אמר כלום:
נזיקין	בבא מציעא	א	1160	ראה את המציאה ונפל עליה ובא אחר והחזיק בה זה שהחזיק בה זכה בה:
נזיקין	בבא מציעא	א	1161	ראה אותן רצין אחר מציאה אחר צבי שבור אחר גוזלות שלא פרחו ואמר זכתה לי שדי זכתה לו היה צבי רץ כדרכו או שהיו גוזלות מפריחין ואמר זכתה לי שדי לא אמר כלום:
נזיקין	בבא מציעא	א	1162	מציאת בנו ובתו הקטנים מציאת עבדו ושפחתו הכנענים מציאת אשתו הרי אלו שלו מציאת בנו ובתו הגדולים מציאת עבדו ושפחתו העברים מציאת אשתו שגירשה אע"פ שלא נתן כתובה הרי אלו שלהן:
נזיקין	בבא מציעא	א	1163	מצא שטרי חוב אם יש בהן אחריות נכסים לא יחזיר שבית דין נפרעין מהן אין בהן אחריות נכסים יחזיר שאין בית דין נפרעין מהן דברי רבי מאיר וחכמים אומרים בין כך ובין כך לא יחזיר מפני שבית דין נפרעין מהן:
נזיקין	בבא מציעא	א	1164	מצא גיטי נשים ושחרורי עבדים דייתיקי מתנה ושוברין הרי זה לא יחזיר שאני אומר כתובין היו ונמלך עליהן שלא לתנן:
נזיקין	בבא מציעא	ב	1165	מצא איגרות שום ואיגרות מזון שטרי חליצה ומיאונין ושטרי בירורין וכל מעשה ב"ד הרי זה יחזיר מצא בחפיסה או בדלוסקמא תכריך של שטרות או אגודה של שטרות הרי זה יחזיר וכמה אגודה של שטרות שלשה קשורין זה בזה רשב"ג אומר אחד הלוה משלשה יחזיר ללוה שלשה הלוין מן האחד יחזיר למלוה מצא שטר בין שטרותיו ואינו יודע מה טיבו יהא מונח עד שיבא אליהו אם יש עמהן סמפונות יעשה מה שבסמפונות:
נזיקין	בבא מציעא	ב	1166	אלו מציאות שלו ואלו חייב להכריז אלו מציאות שלו מצא פירות מפוזרין מעות מפוזרות כריכות ברשות הרבים ועגולי דבילה ככרות של נחתום מחרוזות של דגים וחתיכות של בשר וגיזי צמר הלקוחין ממדינתן ואניצי פשתן ולשונות של ארגמן הרי אלו שלו דברי רבי מאיר ר' יהודה אומר כל שיש בו שינוי חייב להכריז כיצד מצא עגול ובתוכו חרס ככר ובתוכו מעות רבי שמעון בן אלעזר אומר כל כלי אנפוריא אין חייב להכריז:
נזיקין	בבא מציעא	ב	1167	ואלו חייב להכריז מצא פירות בכלי או כלי כמות שהוא מעות בכיס או כיס כמות שהוא צבורי פירות צבורי מעותשלשה מטבעות זה על גב זה כריכות ברה"י וככרות של בעה"ב וגיזי צמר הלקוחין מבית האומן כדי יין וכדי שמן הרי אלו חייב להכריז:
נזיקין	בבא מציעא	ב	1168	מצא אחר הגפה או אחר הגדר גוזלות מקושרים או בשבילין שבשדות הרי זה לא יגע בהן מצא כלי באשפה אם מכוסה לא יגע בו אם מגולה נוטל ומכריז:
נזיקין	בבא מציעא	ב	1169	מצא בגל ובכותל ישן הרי אלו שלו מצא בכותל חדש מחציו ולחוץ שלו מחציו ולפנים של בעל הבית אם היה משכירו לאחרים אפילו בתוך הבית הרי אלו שלו:
