נשים	יבמות	ג	593	שלשה אחין שנים נשואים שתי אחיות ואחד מופנה מת אחד מבעלי אחיות ועשה בה מופנה מאמר ואח"כ מת אחיו השני בש"א אשתו עמו והלזו תצא משום אחות אשה וב"ה אומרים מוציא את אשתו בגט ובחליצה ואשת אחיו בחליצה זו היא שאמרו אוי לו על אשתו ואוי לו על אשת אחיו:
נשים	יבמות	ג	594	שלשה אחין שנים מהם נשואים שתי אחיות ואחד נשוי נכרית מת אחד מבעלי אחיות וכנס נשוי נכרית את אשתו ומת הראשונה יוצאה משום אחות אשה ושניה משום צרתה עשה בה מאמר ומת נכרית חולצת ולא מתייבמת:
נשים	יבמות	ג	595	שלשה אחים שנים מהם נשואים שתי אחיות ואחד נשוי נכרית מת הנשוי נכרית וכנס אחד מבעלי אחיות את אשתו ומת הראשונה יוצאת משום אחות אשה ושניה משום צרתה עשה בה מאמר ומת נכרית חולצת ולא מתייבמת:
נשים	יבמות	ג	596	שלשה אחין שנים מהם נשואים שתי אחיות ואחד נשוי נכרית מת אחד מבעלי אחיות וכנס נשוי נכרית את אשתו ומתה אשתו של שני ואח"כ מת נשוי נכרית הרי זו אסורה עליו עולמית הואיל ונאסרה עליו שעה אחת:
נשים	יבמות	ג	597	שלשה אחים שנים מהם נשואין שתי אחיות ואחד נשוי נכרית גירש אחד מבעלי אחיות את אשתו ומת נשוי נכרית וכנסה המגרש ומת זו היא שאמרו וכולן שמתו או נתגרשו צרותיהן מותרות:
נשים	יבמות	ג	598	וכולן שהיו בהן קדושין או גרושין בספק הרי אלו הצרות חולצות ולא מתייבמות כיצד ספק קדושין זרק לה קדושין ספק קרוב לו ספק קרוב לה זהו ספק קדושין ספק גרושין כתב בכתב ידו ואין עליו עדים יש עליו עדים ואין בו זמן יש בו זמן ואין בו אלא עד אחד זהו ספק גרושין:
נשים	יבמות	ג	599	ג' אחין נשואין ג' נכריות ומת אחד מהן ועשה בה השני מאמר ומת הרי אלו חולצות ולא מתייבמות שנאמר (דברים כה) ומת אחד מהן יבמה יבא עליה שעליה זיקת יבם אחד ולא שעליה זיקת ב' יבמין רבי שמעון אומר מייבם לאיזו שירצה וחולץ לשניה:
נשים	יבמות	ג	600	שני אחין נשואין שתי אחיות ומת אחד מהן ואחר כך מתה אשתו של שני הרי זו אסורה עליו עולמית הואיל ונאסרה עליו שעה אחת:
נשים	יבמות	ד	601	שנים שקידשו שתי נשים ובשעת כניסתן לחופה החליפו את של זה לזה ואת של זה לזה הרי אלו חייבין משום אשת איש ואם היו אחין משום אשת אח ואם היו אחיות משום אשה אל אחותה ואם היו נדות משום נדה ומפרישין אותן שלשה חדשים שמא מעוברות הן ואם היו קטנות שאינן ראויות לילד מחזירים אותן מיד ואם היו כהנות נפסלו מן התרומה:
נשים	יבמות	ד	602	החולץ ליבמתו ונמצאת מעוברת וילדה בזמן שהולד של קיימא הוא מותר בקרובותיה והיא מותרת בקרוביו ולא פסלה מן הכהונה אין הולד של קיימא הוא אסור בקרובותיה והיא אסורה בקרוביו ופסלה מן הכהונה הכונס את יבמתו ונמצאת מעוברת וילדה בזמן שהולד של קיימא יוציא וחייבין בקרבן ואם אין ולד של קיימא יקיים ספק בן תשעה לראשון ספק בן שבעה לאחרון יוציא והולד כשר וחייבין באשם תלוי:
נשים	יבמות	ד	603	שומרת יבם שנפלו לה נכסים מודים ב"ש וב"ה שמוכרת ונותנת וקיים מתה מה יעשה בכתובתה ובנכסים הנכנסים ויוצאין עמה ב"ש אומרים יחלוקו יורשי הבעל עם יורשי האב וב"ה אומרים נכסים בחזקתן כתובה בחזקת יורשי הבעל נכסים הנכנסים ויוצאין עמה בחזקת יורשי האב כנסה הרי היא כאשתו לכל דבר ובלבד שתהא כתובה על נכסי בעלה הראשון:
נשים	יבמות	ד	604	מצוה בגדול לייבם לא רצה מהלכין על כל האחין לא רצו חוזרין אצל גדול ואומרים לו עליך מצוה או חלוץ או ייבם תלה בקטן עד שיגדיל או בגדול עד שיבא ממדינת הים או חרש או שוטה אין שומעין לו אלא אומרים לו עליך מצוה או חלוץ או ייבם:
נשים	יבמות	ד	605	החולץ ליבמתו הרי הוא כאחד מן האחין לנחלה ואם יש שם אב נכסים של אב הכונס את יבמתו זכה בנכסים של אחיו ר' יהודה אומר בין כך ובין כך אם יש שם אב נכסים של אב:
נשים	יבמות	ד	606	החולץ ליבמתו הוא אסור בקרובותיה והיא אסורה בקרוביוהוא אסור באמה ובאם אמה ובאם אביה ובבתה ובבת בתה ובבת בנה ובאחותה בזמן שהיא קיימת והאחין מותרין והיא אסורה באביו ובאבי אביו ובבנו ובבן בנו באחיו ובבן אחיו מותר אדם בקרובת צרת חלוצתו ואסור בצרת קרובת חלוצתו:
נשים	יבמות	ד	607	החולץ ליבמתו ונשא אחיו את אחותה ומת חולצת ולא מתיבמת וכן המגרש את אשתו ונשא אחיו את אחותה ומת הרי זו פטורה שומרת יבם שקידש אחיו את אחותה משום רבי יהודה בן בתירא אמרו אומרים לו המתן עד שיעשה אחיך מעשה חלץ לה אחיו או כנסה יכנוס את אשתו מתה היבמה יכנוס את אשתו מת יבם יוציא את אשתו בגט ואשת אחיו בחליצה:
נשים	יבמות	ד	608	היבמה לא תחלוץ ולא תתייבם עד שיש לה שלשה חדשים וכן כל שאר הנשים לא יתארסו ולא ינשאו עד שיהו להן שלשה חדשים אחד בתולות ואחד בעולות אחד גרושות ואחד אלמנות אחד נשואות ואחד ארוסות רבי יהודה אומר הנשואות יתארסו והארוסות ינשאו חוץ מן הארוסות שביהודה מפני שלבו גס בה ר' יוסי אומר כל הנשים יתארסו חוץ מן האלמנהמפני האיבול:
נשים	יבמות	ד	609	ארבעה אחין נשואין ארבע נשים ומתו אם רצה הגדול שבהם לייבם את כולן הרשות בידו מי שהיה נשוי לשתי נשים ומת ביאתה או חליצתה של אחת מהן פוטרת צרתההיתה אחת כשרה ואחת פסולה אם היה חולץ חולץ לפסולה ואם היה מייבם מייבם לכשרה:
נשים	יבמות	ד	610	המחזיר גרושתו והנושא חלוצתו והנושא קרובת חלוצתו יוציא והולד ממזר דברי ר"ע וחכ"א אין הולד ממזר ומודים בנושא קרובת גרושתו שהולד ממזר:
נשים	יבמות	ה	611	איזהו ממזר כל שאר בשר שהוא בלא יבא דברי ר"ע שמעון התימני אומר כל שחייבים עליו כרת בידי שמים והלכה כדבריו ורבי יהושע אומר כל שחייבין עליו מיתת בית דין אמר רבי שמעון בן עזאי מצאתי מגלת יוחסין בירושלים וכתוב בה איש פלוני ממזר מאשת איש לקיים דברי רבי יהושע אשתו שמתה מותר באחותה גרשה ומתה מותר באחותה נשאת לאחר ומתה מותר באחותה יבמתו שמתה מותר באחותה חלץ לה ומתה מותר באחותה נשאת לאחר ומתה מותר באחותה:
נשים	יבמות	ו	612	רבן גמליאל אומר אין גט אחר גט ולא מאמר אחר מאמר ולא בעילה אחר בעילה ולא חליצה אחר חליצה וחכמים אומרים יש גט אחר גט ויש מאמר אחר מאמר אבל לא אחר בעילה ולא אחר חליצה כלום כיצד עשה מאמר ביבמתו ונתן לה גט צריכה הימנו חליצה עשה מאמר וחליצה צריכה הימנו גט עשה מאמר ובעל הרי זו כמצותה נתן גט ועשה מאמר צריכה גט וחליצה נתן גט ובעל צריכה גט וחליצה נתן גט וחלץ אין אחר חליצה כלום חלץ ועשה מאמר נתן גט ובעל או בעל ועשה מאמר נתן גט וחלץ אין אחר חליצה כלוםאחת יבמה אחת ליבם אחד ואחת שתי יבמות ליבם אחד כיצד עשה מאמר בזו ומאמר בזו צריכות שני גיטין וחליצה מאמר בזו וגט לזו צריכה גט וחליצה מאמר בזו ובעל את זו צריכות ב' גיטין וחליצה מאמר בזו וחלץ לזו הראשונה צריכה גט גט לזו וגט לזו צריכות הימנו חליצה גט לזו ובעל את זו צריכה גט וחליצה גט לזו ומאמר בזו צריכה גט וחליצה גט לזו וחלץ לזו אין אחר חליצה כלום חלץ וחלץ או חלץ ועשה מאמר נתן גט ובעל או בעל ובעל או בעל ועשה מאמר נתן גט וחלץ אין אחר חליצה כלום בין יבם אחד לשתי יבמות בין שני יבמין ליבמה אחת חלץ ועשה מאמר נתן גט ובעל או בעל ועשה מאמר ונתן גט וחלץ אין אחר חליצה כלום בין בתחלה בין באמצע בין בסוף והבעילה בזמן שהיא בתחלה אין אחריה כלום באמצע ובסוף יש אחריה כלום רבי נחמיה אומר אחת בעילה ואחת חליצה בין בתחלה בין באמצע בין בסוף אין אחריה כלום:
נשים	יבמות	ו	613	הבא על יבמתו בין בשוגג בין במזיד בין באונס בין ברצון אפי' הוא שוגג והיא מזידה הוא מזיד והיא שוגגת הוא אנוס והיא לא אנוסה היא אנוסה והוא לא אנוס אחד המערה ואחד הגומר קנה ולא חילק בין ביאה לביאה וכן הבא על אחת מכל העריות שבתורה או פסולות כגון אלמנה לכ"ג גרושה וחלוצה לכהן הדיוט ממזרת ונתינה לישראל בת ישראל לממזר ולנתין פסלה ולא חילק בין ביאה לביאה:
נשים	יבמות	ו	614	אלמנה לכהן גדול גרושה וחלוצה לכהן הדיוט מן האירוסין לא יאכלו בתרומה רבי אלעזר ורבי שמעון מכשירין נתארמלו או נתגרשו מן הנשואין פסולות מן האירוסין כשרות:
נשים	יבמות	ו	615	כהן גדול לא ישא אלמנה בין אלמנה מן האירוסין בין אלמנה מן הנישואין ולא ישא את הבוגרת ר' אלעזר ור' שמעון מכשירין בבוגרת [ולא ישא את מוכת עץ]:
נשים	יבמות	ו	616	אירס את האלמנה ונתמנה להיות כהן גדול יכנוס ומעשה ביהושע בן גמלא שקדש את מרתא בת ביתוס ומנהו המלך להיות כה"ג וכנסה שומרת יבם שנפלה לפני כהן הדיוט ונתמנה להיות כה"ג אע"פ שעשה בה מאמר הרי זה לא יכנוס:
נשים	יבמות	ו	617	כהן גדול שמת אחיו חולץ ולא מייבם:
נשים	יבמות	ו	618	כהן הדיוט לא ישא אילונית אלא א"כ יש לו אשה ובנים רבי יהודה אומר אע"פ שיש לו אשה ובנים לא ישא אילונית שהיא זונה האמורה בתורה וחכמים אומרים אין זונה אלא גיורת ומשוחררת ושנבעלה בעילת זנות:
נשים	יבמות	ו	619	לא יבטל אדם מפריה ורביה אלא א"כ יש לו בנים ב"ש אומרים שני זכרים וב"ה אומרים זכר ונקבה שנאמר (בראשית ה) זכר ונקבה בראם:
נשים	יבמות	ו	620	נשא אשה ושהה עמה עשר שנים ולא ילדה אינו רשאי לבטל גירשה מותרת לינשא לאחר ורשאי השני לשהות עמה י' שנים ואם הפילה מונה משעה שהפילה:
נשים	יבמות	ז	621	האיש מצווה על פריה ורביה אבל לא האשה רבי יוחנן בן ברוקה אומר על שניהם הוא אומר (בראשית א) ויברך אותם אלהים ויאמר להם [אלהים] פרו ורבו:
נשים	יבמות	ז	622	אלמנה לכהן גדול גרושה וחלוצה לכהן הדיוט הכניסה לו עבדי מלוג ועבדי צאן ברזל עבדי מלוג לא יאכלו בתרומה עבדי צאן ברזל יאכלו ואלו הן עבדי מלוג אם מתו מתו לה ואם הותירו הותירו לה אע"פ שהוא חייב במזונותן הרי אלו לא יאכלו בתרומה ואלו הן עבדי צאן ברזל אם מתו מתו לו ואם הותירו הותירו לו הואיל והוא חייב באחריותן הרי אלו יאכלו בתרומה בת ישראל שניסת לכהן והכניסה לו עבדים בין עבדי מלוג בין עבדי צאן ברזל הרי אלו יאכלו בתרומה ובת כהן שניסת לישראל והכניסה לו עבדים בין עבדי מלוג בין עבדי צאן ברזל הרי אלו לא יאכלו בתרומה:
נשים	יבמות	ז	623	בת ישראל שניסת לכהן ומת והניחה מעוברת לא יאכלו עבדיה בתרומה מפני חלקו של עובר שהעובר פוסל ואינו מאכיל דברי ר' יוסי אמרו לו מאחר שהעדת לנו על בת ישראל לכהן אף בת כהן לכהן ומת והניחה מעוברת לא יאכלו עבדיה בתרומה מפני חלקו של עובר:
נשים	יבמות	ז	624	העובר והיבם והאירוסין והחרש ובן תשע שנים ויום אחד פוסלין ולא מאכילין ספק שהוא בן ט' שנים ויום אחד ספק שאינו ספק הביא ב' שערות וספק שלא הביא נפל הבית עליו ועל בת אחיו ואין ידוע אי זה מת ראשון צרתה חולצת ולא מתייבמת:
נשים	יבמות	ח	625	האונס והמפתה והשוטה לא פוסלין ולא מאכילין ואם אינן ראויין לבא בישראל הרי אלו פוסלין כיצד <היה> ישראל שבא על בת כהן תאכל בתרומהעיברה לא תאכל בתרומה נחתך העובר במעיה תאכל היה כהן שבא על בת ישראל לא תאכל בתרומה עיברה לא תאכל ילדה תאכל נמצא כחו של בן גדול משל אב העבד פוסל משום ביאה ואינו פוסל משום זרע כיצד בת ישראל לכהן בת כהן לישראל וילדה הימנו בן והלך הבן ונכבש על השפחה וילדה הימנו בן הרי זה עבד היתה אם אביו בת ישראל לכהן לא תאכל בתרומה בת כהן לישראל תאכל בתרומה ממזר פוסל ומאכיל כיצד בת ישראל לכהן ובת כהן לישראל וילדה הימנו בת והלכה הבת ונישאת לעבד או <לעובד כוכבים> {לנכרי} וילדה הימנו בן הרי זה ממזר היתה אם אמו בת ישראל לכהן תאכל בתרומה בת כהן לישראל לא תאכל בתרומה כהן גדול פעמים שהוא פוסל כיצד בת כהן לישראל וילדה הימנו בת והלכה הבת וניסת לכהן וילדה הימנו בן ה"ז ראוי להיות כהן גדול עומד ומשמש על גבי המזבח מאכיל את אמו ופוסל אם אמו זאת אומרת לא כבני כ"ג שהוא פוסלני מן התרומה:
נשים	יבמות	ח	626	הערל וכל הטמאים לא יאכלו בתרומה נשיהן ועבדיהן יאכלו בתרומה פצוע דכא וכרות שפכה הן ועבדיהן יאכלו ונשיהן לא יאכלו ואם לא ידעה משנעשה פצוע דכא וכרות שפכה הרי אלו יאכלו ואי זהו פצוע דכא כל שנפצעו הביצים שלו ואפילו אחת מהן וכרות שפכה כל שנכרת הגיד ואם נשתייר מעטרה אפי' כחוט השערה כשר:
נשים	יבמות	ח	627	פצוע דכא וכרות שפכה מותרין בגיורת ומשוחררת ואינן אסורין אלא מלבא בקהל שנאמר (דברים כג) לא יבא פצוע דכא וכרות שפכה בקהל ה':
נשים	יבמות	ח	628	עמוני ומואבי אסורים ואיסורן איסור עולם אבל נקבותיהם מותרות מיד מצרי ואדומי אינם אסורים אלא עד שלשה דורות אחד זכרים ואחד נקבות ר"ש מתיר את הנקבות מיד א"ר שמעון ק"ו הדברים ומה אם במקום שאסר את הזכרים איסור עולם התיר את הנקבות מיד מקום שלא אסר את הזכרים אלא עד שלשה דורות אינו דין שנתיר את הנקבות מיד אמרו לו אם הלכה נקבל ואם לדין יש תשובה אמר להם לא כי הלכה אני אומר:
נשים	יבמות	ח	629	ממזרין ונתינין אסורין ואיסורן איסור עולם אחד זכרים ואחד נקבות:
נשים	יבמות	ח	630	אמר רבי יהושע שמעתי שהסריס חולץ וחולצין לאשתו והסריס לא חולץ ולא חולצין לאשתו ואין לי לפרש א"ר עקיבא אני אפרש סריס אדם חולץ וחולצין לאשתו מפני שהיתה לו שעת הכושר סריס חמה לא חולץ ולא חולצין לאשתו מפני שלא היתה לו שעת הכושר ר' אליעזר אומר לא כי אלא סריס חמה חולץ וחולצין לאשתו מפני שיש לו רפואה סריס אדם לא חולץ ולא חולצין לאשתו מפני שאין לו רפואה העיד ר' יהושע בן בתירא על בן מגוסת שהיה בירושלים סריס אדם ויבמו את אשתו לקיים דברי ר"ע הסריס לא חולץ ולא מייבם וכן איילונית לא חולצת ולא מתייבמת הסריס שחלץ ליבמתו לא פסלה בעלה פסלה מפני שהיא בעילת זנות וכן איילונית שחלצו לה אחין לא פסלוה בעלוה פסלוה מפני שבעילתה בעילת זנות:
נשים	יבמות	ט	631	סריס חמה כהן שנשא בת ישראל מאכילה בתרומה רבי יוסי ור"ש אומרים אנדרוגינוס כהן שנשא בת ישראל מאכילה בתרומה ר' יהודה אומר טומטום שנקרע ונמצא זכר לא יחלוץ מפני שהוא כסריס אנדרוגינוס נושא אבל לא נישא ר' אליעזר אומר אנדרוגינוס חייבין עליו סקילה כזכר:
נשים	יבמות	ט	632	יש מותרות לבעליהן ואסורות ליבמיהן מותרות ליבמיהן ואסורות לבעליהן מותרות לאלו ולאלו ואסורות לאלו ולאלו ואלו מותרות לבעליהן ואסורות ליבמיהן כהן הדיוט שנשא את האלמנה ויש לו אח כ"ג חלל שנשא כשרה ויש לו אח כשר ישראל שנשא בת ישראל ויש לו אח ממזר ממזר שנשא ממזרת ויש לו אח ישראל מותרות לבעליהן ואסורות ליבמיהן ואלו מותרות ליבמיהן ואסורות לבעליהן כ"ג שקידש את האלמנה ויש לו אח כהן הדיוט כשר שנשא חללה ויש לו אח חלל ישראל שנשא ממזרת ויש לו אח ממזר ממזר שנשא בת ישראל ויש לו אח ישראל מותרות ליבמיהן ואסורות לבעליהן ואלו אסורות לאלו ולאלו כהן גדול שנשא את האלמנה ויש לו אח כהן גדול או כהן הדיוט כשר שנשא חללה ויש לו אח כשר ישראל שנשא ממזרת ויש לו אח ישראל ממזר שנשא בת ישראל ויש לו אח ממזר אסורות לאלו ולאלו ושאר כל הנשים מותרות לבעליהן וליבמיהן שניות מד"ס שנייה לבעל ולא שנייה ליבם אסורה לבעל ומותרת ליבם שנייה ליבם ולא שנייה לבעל אסורה ליבם ומותרת לבעל שנייה לזה ולזה אסורה לזה ולזה אין לה לא כתובה ולא פירות ולא מזונות ולא בלאות והולד כשר וכופין אותו להוציא אלמנה לכ"ג גרושה וחלוצה לכהן הדיוט ממזרת ונתינה לישראל בת ישראל לנתין ולממזר יש להן כתובה:
נשים	יבמות	ט	633	בת ישראל מאורסת לכהן מעוברת מכהן שומרת יבם לכהן וכן בת כהן לישראל לא תאכל בתרומה בת ישראל מאורסת ללוי מעוברת מלוי שומרת יבם ללוי וכן בת לוי לישראל לא תאכל במעשר בת לוי מאורסת לכהן מעוברת מכהן שומרת יבם לכהן וכן בת כהן ללוי לא תאכל לא בתרומה ולא במעשר:
נשים	יבמות	י	634	בת ישראל שניסת לכהן תאכל בתרומה מת ולה הימנו בן תאכל בתרומה ניסת ללוי תאכל במעשר מת ולה הימנו בן תאכל במעשר ניסת לישראל לא תאכל לא בתרומה ולא במעשר מת ולה הימנו בן לא תאכל לא בתרומה ולא במעשר מת בנה מישראל תאכל במעשר מת בנה מלוי תאכל בתרומה מת בנה מכהן לא תאכל לא בתרומה ולא במעשרבת כהן שניסת לישראל לא תאכל בתרומה מת ולה הימנו בן לא תאכל בתרומה ניסת ללוי תאכל במעשר מת ולה הימנו בן תאכל במעשר ניסת לכהן תאכל בתרומה מת ולה הימנו בן תאכל בתרומה מת בנה מכהן לא תאכל בתרומה מת בנה מלוי לא תאכל במעשר מת בנה מישראל חוזרת לבית אביה ועל זו נאמר (ויקרא כב) ושבה אל בית אביה כנעוריה מלחם אביה תאכל:
נשים	יבמות	י	635	האשה שהלך בעלה למדינת הים ובאו ואמרו לה מת בעליך וניסת ואח"כ בא בעלה תצא מזה ומזה וצריכה גט מזה ומזה ואין לה כתובה ולא פירות ולא מזונות ולא בלאות לא על זה ולא על זה ואם נטלה מזה ומזה תחזיר והולד ממזר מזה ומזה ולא זה וזה מטמא לה ולא זה וזה זכאים לא במציאתה ולא במעשה ידיה ולא בהפרת נדריה היתה בת ישראל נפסלה מן הכהונה ובת לוי מן המעשר ובת כהן מן התרומה ואין יורשין של זה ויורשין של זה יורשין את כתובתה ואם מתו אחיו של זה ואחיו של זה חולצין ולא מייבמין ר' יוסי אומר כתובתה על נכסי בעלה הראשון רבי אלעזר אומר הראשון זכאי במציאתה ובמעשה ידיה ובהפרת נדריה רבי שמעון אומר ביאתה או חליצתה מאחיו של ראשון פוטרת צרתה ואין הולד ממנו ממזר ואם ניסת שלא ברשות מותרת לחזור לו ניסת על פי ב"ד תצא ופטורה מן הקרבן לא ניסת על פי ב"ד תצא וחייבת בקרבן יפה כח ב"ד שפוטרה מן הקרבן הורוה ב"ד לינשא והלכה וקלקלה חייבת בקרבן שלא התירוה אלא לינשא:
